Sección,Concepto,Regla_Criterio
2.1,Plazo Máximo,Garantía de Satisfacción de 14 días naturales desde la fecha de compra.
2.1,Condición de Progreso,El usuario no debe haber completado ni visualizado más del 20% del contenido total del curso o carrera.
2.1,Excepciones,Membresías anuales o planes de suscripción mensual ya renovados NO son reembolsables. Cancelaciones detienen el próximo cobro.
2.2,Canal de Solicitud,Enviar correo a soporte@escuelaluis.com con asunto: Solicitud de Reembolso - [Nombre de Usuario].
2.2,Tiempo de Procesamiento,El proceso de evaluación y devolución tarda entre 5 y 10 días hábiles según el método de pago.
