Tipo_Programa,Concepto,Detalles_Y_Condiciones
Becas,Beneficio,"Exención del 50% al 100% de la matricula para zonas vulnerables, desempleados o perfiles con alto potencial."
Becas,Proceso de Aplicación,Llenar formulario en /becas adjuntando carta de motivos y comprobantes socioeconómicos Convocatoria trimestral.
Afiliados,Funcionamiento,Estudiantes activos o creadores obtienen un enlace personalizado para referir nuevos alumnos.
Afiliados,Comisiones,Recibes el 20% de comisión por cada venta directa realizada a través de tu enlace de afiliado.
Afiliados,Política de Pago,Pago mensual los días 5 mediante PayPal o transferencia. Mínimo acumulado $50 USD y que pase la garantía de 14 días
